{
  "$schema": "../../schemas/autonomous-seo-founder-approval.schema.json",
  "schema_version": "1.0.0",
  "approval_id": "p0-founder-approval-2026-09-06",
  "program_id": "autonomous-seo-expansion",
  "phase_id": "P0",
  "approval_model": "FOUNDER_CONTROLLED",
  "approved_by": "wfprieto",
  "approval_recorded_on": "2026-09-06",
  "approval_source": "Repository founder authorization recorded in the ChatGPT Work conversation.",
  "candidate_commit": "9585dd525d9b0eb6c9c986b1356075064c61b7ca",
  "approval_state": "APPROVED",
  "authorized_next_phase": "P1",
  "external_write_authorized": false,
  "required_external_write_controls": [
    "Founder approval for each external action queue item",
    "Affected URLs or systems, rollback plan, and verification method",
    "No unreviewed publishing, provider write, outreach, GBP, or spend changes"
  ],
  "verification_summary": [
    "The merged P0 closure commit passed the full local suite and both required GitHub workflows before approval was finalized.",
    "No external SEO action is authorized by this record.",
    "Founder approval does not bypass repository validation, rollback certification, or per-action external approval."
  ]
}
